<?xml version="1.0" encoding="UTF-8"?>
<!--
  resultados.dtd
  Reglas de los documentos XML con resultados y estadísticas de partidos
  de la Liga MX. Fuente de los datos: ESPN México.
-->

<!-- ===================== Estructura general ===================== -->

<!-- Una liga contiene una o más jornadas -->
<!ELEMENT liga (jornada+)>
<!ATTLIST liga
    nombre     CDATA #REQUIRED
    torneo     CDATA #REQUIRED
    temporada  CDATA #REQUIRED>

<!-- Una jornada contiene uno o más partidos -->
<!ELEMENT jornada (partido+)>
<!ATTLIST jornada
    numero     CDATA #REQUIRED>

<!-- Exactamente un local y un visitante, en ese orden.
     El marcador es opcional: un partido programado aún no lo tiene. -->
<!ELEMENT partido (fecha, hora, estadio, equipoLocal, equipoVisitante, marcador?)>
<!ATTLIST partido
    id         ID    #REQUIRED
    estado     (programado | en_juego | finalizado | suspendido | pospuesto) #REQUIRED>

<!ELEMENT fecha   (#PCDATA)>  <!-- AAAA-MM-DD -->

<!ELEMENT hora    (#PCDATA)>  <!-- HH:MM -->
<!-- Por omisión, tiempo del centro de México; un estadio en otra zona
     (Tijuana, por ejemplo) puede indicar la suya. -->
<!ATTLIST hora
    zona       CDATA "UTC-06:00">

<!ELEMENT estadio (#PCDATA)>
<!ATTLIST estadio
    ciudad     CDATA #REQUIRED>

<!-- ================== Equipos y estadísticas ==================== -->

<!ELEMENT equipoLocal     (nombre, estadisticas?)>
<!ATTLIST equipoLocal
    abreviatura CDATA #REQUIRED>

<!ELEMENT equipoVisitante (nombre, estadisticas?)>
<!ATTLIST equipoVisitante
    abreviatura CDATA #REQUIRED>

<!ELEMENT nombre          (#PCDATA)>

<!-- Seis estadísticas obligatorias y dos opcionales -->
<!ELEMENT estadisticas (posesion, tiros, tirosAPuerta, faltas, tirosDeEsquina,
                        fuerasDeLugar?, atajadas?, tarjetas)>
<!ELEMENT posesion       (#PCDATA)>  <!-- porcentaje, p. ej. 54.3 -->
<!ELEMENT tiros          (#PCDATA)>
<!ELEMENT tirosAPuerta   (#PCDATA)>
<!ELEMENT faltas         (#PCDATA)>
<!ELEMENT tirosDeEsquina (#PCDATA)>
<!ELEMENT fuerasDeLugar  (#PCDATA)>
<!ELEMENT atajadas       (#PCDATA)>

<!-- Cero o más tarjetas; el contenido de cada una es el nombre del jugador -->
<!ELEMENT tarjetas (tarjeta*)>
<!ELEMENT tarjeta  (#PCDATA)>
<!-- minuto y agregado se separan: 45+1 se escribe minuto="45" agregado="1" -->
<!ATTLIST tarjeta
    color      (amarilla | roja) #REQUIRED
    minuto     NMTOKEN #REQUIRED
    agregado   NMTOKEN #IMPLIED>

<!-- ========================== Marcador ========================== -->

<!-- Goles de cada lado y, opcionalmente, el detalle de cada gol.
     El contenido de gol es el nombre del anotador. -->
<!ELEMENT marcador       (golesLocal, golesVisitante, gol*)>
<!ELEMENT golesLocal     (#PCDATA)>
<!ELEMENT golesVisitante (#PCDATA)>
<!ELEMENT gol            (#PCDATA)>
<!-- equipo: lado al que se le cuenta el gol.
     autogol (agregado en la Actividad 9): el anotador es del equipo
     contrario al que se le cuenta el gol. -->
<!ATTLIST gol
    equipo     (local | visitante) #REQUIRED
    minuto     NMTOKEN #REQUIRED
    agregado   NMTOKEN #IMPLIED
    tipo       (jugada | penal | autogol) "jugada">
